{
  "document": "U1",
  "note": "Delta written by the researcher after U1 is revealed. It only adds data; the engine code is not changed.",
  "relevant": true,
  "add": [],
  "tables": [
    {"name": "TER-CATEGORY", "valid_from": "2026-01-01",
     "extract": {"file": "dataset/01_regulasi/tables/ptkp.csv", "key": "status", "value": "kategori_ter", "prefix": "TER-",
                 "override": {"K/3": "TER-D"}},
     "source": {"document": "Peraturan fiktif U1", "article": "Ps. 1", "quote": "Dibentuk kategori D untuk pegawai berstatus K/3"}},
    {"name": "TER-D", "valid_from": "2026-01-01",
     "rows": [{"lower": 0, "upper": 8000000, "value": "0.5"}, {"lower": 8000000, "upper": null, "value": "2"}],
     "source": {"document": "Peraturan fiktif U1", "article": "Ps. 2", "quote": "Tarif efektif bulanan kategori D"}}
  ]
}
